<?xml version="1.0" encoding="UTF-8" standalone="no"?><hotel xmlns:xsi="http://www.w3.org/2001/XMLSchema-instance" xsi:noNamespaceSchemaLocation="XMLSchemaHMS1DU.xsd">
  
  <!-- Vendégek -->
  <vendeg>
    <vendegID>V001</vendegID>
    <nev>Kovács János</nev>
    <nem>férfi</nem>
    <okmany>
      <tipus>útlevél</tipus>
      <szam>AB123456</szam>
    </okmany>
    <orszag>Magyarország</orszag>
  </vendeg>
  
  <vendeg>
    <vendegID>V002</vendegID>
    <nev>Nagy Eszter</nev>
    <nem>nő</nem>
    <okmany>
      <tipus>személyi</tipus>
      <szam>123456AB</szam>
    </okmany>
    <orszag>Magyarország</orszag>
  </vendeg>
  
  <!-- Szobák -->
  <szoba>
    <szobaszam>101</szobaszam>
    <tipus>1 ágyas</tipus>
    <ar>15000</ar>
    <status>foglalt</status>
  </szoba>
  
  <szoba>
    <szobaszam>201</szobaszam>
    <tipus>2 ágyas</tipus>
    <ar>25000</ar>
    <status>foglalt</status>
  </szoba>
  
  <!-- Foglalások -->
  <foglalas>
    <foglalasID>F001</foglalasID>
    <vendegID>V001</vendegID>
    <szobaszam>101</szobaszam>
    <erkezes>2025-05-10</erkezes>
    <tavozas>2025-05-15</tavozas>
    <szolgaltatasok>
      <szolgaltatasID>S001</szolgaltatasID>
      <szolgaltatasID>S002</szolgaltatasID>
    </szolgaltatasok>
  </foglalas>
  
  <!-- Szolgáltatások -->
  <szolgaltatas>
    <szolgaltatasID>S001</szolgaltatasID>
    <nev>reggeli</nev>
    <ar>3000</ar>
  </szolgaltatas>
  
  <szolgaltatas>
    <szolgaltatasID>S002</szolgaltatasID>
    <nev>parkolás</nev>
    <ar>2000</ar>
  </szolgaltatas>
  
  <!-- Személyzet -->
  <szemelyzet>
    <szemelyzetID>SZ001</szemelyzetID>
    <nev>Kiss Péter</nev>
    <beosztas>portás</beosztas>
    <login>
      <felhasznalonev>kissp</felhasznalonev>
      <jelszo>jelszo123</jelszo>
    </login>
  </szemelyzet>
<vendeg><vendegID>V003</vendegID><nev>Kiss Anna</nev></vendeg></hotel>